{
  "storyId": "memory-sleep-cognition",
  "fixtureId": "marketing-fixture-v2",
  "title": "Why we forget what we read",
  "theme": "memory, sleep, and learning",
  "version": "2.0.0",
  "seed": {
    "rngSeed": 1890,
    "createdAt": "2026-08-23T12:00:00.000Z"
  },
  "sources": [
    {
      "id": "aaaaaaaa-0001-4000-8000-000000000001",
      "kind": "essay",
      "title": "Why highlighting feels like learning",
      "license": "CC0-1.0",
      "attribution": "Original Plethora demo essay.",
      "paths": {
        "html": "sources/01-essay/encoding-versus-highlighting.html",
        "epub": "generated/encoding-versus-highlighting.epub"
      }
    },
    {
      "id": "aaaaaaaa-0002-4000-8000-000000000002",
      "kind": "lecture",
      "title": "Sleep is not downtime for memory",
      "license": "CC0-1.0",
      "attribution": "Original transcript; synthetic WAV labeled as demo tone (not a person).",
      "paths": {
        "transcript": "sources/02-lecture/lecture-transcript.md",
        "chapters": "sources/02-lecture/chapters.json",
        "audio": "generated/lecture-demo.wav"
      }
    },
    {
      "id": "aaaaaaaa-0003-4000-8000-000000000003",
      "kind": "pdf",
      "title": "Spaced retrieval: a one-page methods note",
      "license": "CC0-1.0",
      "attribution": "Original methods one-pager.",
      "paths": {
        "pdf": "generated/spaced-retrieval-methods.pdf"
      }
    },
    {
      "id": "aaaaaaaa-0004-4000-8000-000000000004",
      "kind": "pd-excerpt",
      "title": "Habit and memory (William James, 1890)",
      "license": "CC0-1.0",
      "attribution": "William James, The Principles of Psychology (1890), public domain. Gutenberg-style transcription excerpted for demo use.",
      "paths": {
        "markdown": "sources/04-pd-excerpt/william-james-habit-memory.md",
        "html": "sources/04-pd-excerpt/william-james-habit-memory.html",
        "epub": "generated/william-james-habit-memory.epub"
      }
    },
    {
      "id": "aaaaaaaa-0005-4000-8000-000000000005",
      "kind": "occlusion-diagram",
      "title": "Encoding to retrieval",
      "license": "CC0-1.0",
      "attribution": "Original SVG diagram (no people, no third-party marks).",
      "paths": {
        "svg": "sources/05-occlusion/encoding-retrieval.svg",
        "regions": "sources/05-occlusion/occlusion-regions.json"
      }
    },
    {
      "id": "aaaaaaaa-0006-4000-8000-000000000006",
      "kind": "notes-cards-graph",
      "title": "Notes, cards, review log, connections",
      "license": "CC0-1.0",
      "attribution": "Original fictional study notes; not a real user.",
      "paths": {
        "notes": "sources/06-notes-cards-graph/notes.md",
        "extracts": "sources/06-notes-cards-graph/extracts.json",
        "cards": "sources/06-notes-cards-graph/cards.json",
        "reviewLog": "sources/06-notes-cards-graph/review-log.json",
        "connections": "sources/06-notes-cards-graph/connections.json"
      }
    }
  ],
  "files": [
    {
      "id": "11111111-0001-4000-8000-000000000001",
      "sourceId": "aaaaaaaa-0001-4000-8000-000000000001",
      "path": "sources/01-essay/encoding-versus-highlighting.html",
      "mediaType": "text/html",
      "role": "primary"
    },
    {
      "id": "11111111-0002-4000-8000-000000000002",
      "sourceId": "aaaaaaaa-0002-4000-8000-000000000002",
      "path": "sources/02-lecture/lecture-transcript.md",
      "mediaType": "text/markdown",
      "role": "primary"
    },
    {
      "id": "11111111-0003-4000-8000-000000000003",
      "sourceId": "aaaaaaaa-0003-4000-8000-000000000003",
      "path": "generated/spaced-retrieval-methods.pdf",
      "mediaType": "application/pdf",
      "role": "primary"
    },
    {
      "id": "11111111-0004-4000-8000-000000000004",
      "sourceId": "aaaaaaaa-0004-4000-8000-000000000004",
      "path": "generated/william-james-habit-memory.epub",
      "mediaType": "application/epub+zip",
      "role": "primary"
    },
    {
      "id": "11111111-0005-4000-8000-000000000005",
      "sourceId": "aaaaaaaa-0005-4000-8000-000000000005",
      "path": "sources/05-occlusion/encoding-retrieval.svg",
      "mediaType": "image/svg+xml",
      "role": "primary"
    }
  ],
  "documents": [
    {
      "id": "aaaaaaaa-0001-4000-8000-000000000001",
      "sourceId": "aaaaaaaa-0001-4000-8000-000000000001",
      "fileId": "11111111-0001-4000-8000-000000000001",
      "title": "Why highlighting feels like learning",
      "fileType": "html",
      "category": "Memory",
      "tags": ["encoding", "memory"],
      "priorityRating": 5,
      "prioritySlider": 88,
      "priorityScore": 88,
      "isFavorite": true,
      "nextReadingDate": "2026-08-23T12:00:00.000Z"
    },
    {
      "id": "aaaaaaaa-0002-4000-8000-000000000002",
      "sourceId": "aaaaaaaa-0002-4000-8000-000000000002",
      "fileId": "11111111-0002-4000-8000-000000000002",
      "title": "Sleep is not downtime for memory",
      "fileType": "markdown",
      "category": "Memory",
      "tags": ["sleep", "lecture"],
      "priorityRating": 4,
      "prioritySlider": 72,
      "priorityScore": 72,
      "isFavorite": false,
      "nextReadingDate": "2026-08-24T12:00:00.000Z"
    },
    {
      "id": "aaaaaaaa-0003-4000-8000-000000000003",
      "sourceId": "aaaaaaaa-0003-4000-8000-000000000003",
      "fileId": "11111111-0003-4000-8000-000000000003",
      "title": "Spaced retrieval: a one-page methods note",
      "fileType": "pdf",
      "category": "Methods",
      "tags": ["spacing", "retrieval"],
      "priorityRating": 4,
      "prioritySlider": 61,
      "priorityScore": 61,
      "isFavorite": false,
      "nextReadingDate": "2026-08-25T12:00:00.000Z"
    },
    {
      "id": "aaaaaaaa-0004-4000-8000-000000000004",
      "sourceId": "aaaaaaaa-0004-4000-8000-000000000004",
      "fileId": "11111111-0004-4000-8000-000000000004",
      "title": "Habit and memory (William James, 1890)",
      "fileType": "epub",
      "category": "Classics",
      "tags": ["james", "public-domain"],
      "priorityRating": 3,
      "prioritySlider": 54,
      "priorityScore": 54,
      "isFavorite": true,
      "nextReadingDate": "2026-08-27T12:00:00.000Z"
    },
    {
      "id": "aaaaaaaa-0005-4000-8000-000000000005",
      "sourceId": "aaaaaaaa-0005-4000-8000-000000000005",
      "fileId": "11111111-0005-4000-8000-000000000005",
      "title": "Encoding to retrieval",
      "fileType": "image",
      "category": "Memory",
      "tags": ["occlusion", "retrieval"],
      "priorityRating": 3,
      "prioritySlider": 49,
      "priorityScore": 49,
      "isFavorite": false,
      "nextReadingDate": "2026-08-29T12:00:00.000Z"
    }
  ],
  "queue": [
    { "documentId": "aaaaaaaa-0001-4000-8000-000000000001", "position": 1, "priorityScore": 88, "dueAt": "2026-08-23T12:00:00.000Z" },
    { "documentId": "aaaaaaaa-0002-4000-8000-000000000002", "position": 2, "priorityScore": 72, "dueAt": "2026-08-24T12:00:00.000Z" },
    { "documentId": "aaaaaaaa-0003-4000-8000-000000000003", "position": 3, "priorityScore": 61, "dueAt": "2026-08-25T12:00:00.000Z" },
    { "documentId": "aaaaaaaa-0004-4000-8000-000000000004", "position": 4, "priorityScore": 54, "dueAt": "2026-08-27T12:00:00.000Z" },
    { "documentId": "aaaaaaaa-0005-4000-8000-000000000005", "position": 5, "priorityScore": 49, "dueAt": "2026-08-29T12:00:00.000Z" }
  ],
  "readingProgress": [
    { "documentId": "aaaaaaaa-0001-4000-8000-000000000001", "progressPercent": 24, "currentPage": 3, "currentScrollPercent": 41, "updatedAt": "2026-08-23T11:48:00.000Z" },
    { "documentId": "aaaaaaaa-0002-4000-8000-000000000002", "progressPercent": 62, "currentPage": 1, "currentScrollPercent": 62, "updatedAt": "2026-08-22T19:20:00.000Z" },
    { "documentId": "aaaaaaaa-0003-4000-8000-000000000003", "progressPercent": 100, "currentPage": 1, "currentScrollPercent": 100, "updatedAt": "2026-08-20T08:15:00.000Z" },
    { "documentId": "aaaaaaaa-0004-4000-8000-000000000004", "progressPercent": 36, "currentPage": 2, "currentScrollPercent": 36, "updatedAt": "2026-08-19T17:05:00.000Z" },
    { "documentId": "aaaaaaaa-0005-4000-8000-000000000005", "progressPercent": 0, "currentPage": 1, "currentScrollPercent": 0, "updatedAt": "2026-08-18T10:00:00.000Z" }
  ],
  "notes": [
    {
      "id": "bbbbbbbb-0001-4000-8000-000000000001",
      "documentId": "aaaaaaaa-0001-4000-8000-000000000001",
      "body": "A highlight is a queue, not a memory. Retrieval with the book closed is the test."
    },
    {
      "id": "bbbbbbbb-0002-4000-8000-000000000002",
      "documentId": "aaaaaaaa-0002-4000-8000-000000000002",
      "body": "Sleep replay is biased toward effortful encoding, not toward yellow ink."
    },
    {
      "id": "bbbbbbbb-0003-4000-8000-000000000003",
      "documentId": "aaaaaaaa-0004-4000-8000-000000000004",
      "body": "James: associates are hooks. Isolated rereading leaves nothing to fish with."
    }
  ],
  "extracts": [
    {
      "id": "cccccccc-0001-4000-8000-000000000001",
      "documentId": "aaaaaaaa-0001-4000-8000-000000000001",
      "locator": "essay:fluency",
      "text": "Recognition is cheap. Recall is the skill you actually wanted.",
      "notes": "Turn this contrast into a retrieval prompt.",
      "tags": ["encoding", "retrieval"]
    },
    {
      "id": "cccccccc-0002-4000-8000-000000000002",
      "documentId": "aaaaaaaa-0002-4000-8000-000000000002",
      "locator": "lecture:ch-2",
      "text": "Effort is a teaching signal to the overnight system. Fluency is not.",
      "notes": "Connect effort to overnight replay.",
      "tags": ["sleep", "effort"]
    },
    {
      "id": "cccccccc-0003-4000-8000-000000000003",
      "documentId": "aaaaaaaa-0004-4000-8000-000000000004",
      "locator": "james:hooks",
      "text": "Each of its associates becomes a hook to which it hangs, a means to fish it up by when sunk beneath the surface.",
      "notes": "Association supplies retrieval routes.",